[
  {
    "Id": "637",
    "Name": "Forest",
    "Type": "Terrain",
    "Width": 25.4,
    "Length": 15.24,
    "Height": 0.3,
    "Shape": 0
  },
  {
    "Id": "638",
    "Name": "Hill",
    "Type": "Terrain",
    "Width": 20.32,
    "Length": 15.24,
    "Height": 2.6,
    "Shape": 0
  },
  {
    "Id": "639",
    "Name": "Building",
    "Type": "Terrain",
    "Width": 20.32,
    "Length": 15.24,
    "Height": 12.01,
    "Shape": 0
  },
  {
    "Id": "640",
    "Name": "Impassable",
    "Type": "Terrain",
    "Width": 14.24,
    "Length": 15.24,
    "Height": 10.01,
    "Shape": 0
  },
  {
    "Id": "641",
    "Name": "Arcane Ruin",
    "Type": "Terrain",
    "Width": 20.32,
    "Length": 20.32,
    "Height": 4.5,
    "Shape": 0
  },
  {
    "Id": "642",
    "Name": "Wall",
    "Type": "Terrain",
    "Width": 20.32,
    "Length": 2.59,
    "Height": 1.3,
    "Shape": 0
  },
  {
    "Id": "643",
    "Name": "Marshlands",
    "Type": "Terrain",
    "Width": 25.4,
    "Length": 15.24,
    "Height": 0.5,
    "Shape": 0
  }
]
