[
  {
    "Id": "2762",
    "Name": "Wood2",
    "Type": "Terrain",
    "Width": 15.24,
    "Length": 15.24,
    "Height": 0.3,
    "Shape": 1
  },
  {
    "Id": "2763",
    "Name": "Arcane Monolith",
    "Type": "Terrain",
    "Width": 15.24,
    "Length": 15.24,
    "Height": 10.01,
    "Shape": 0
  },
  {
    "Id": "2764",
    "Name": "Monument of Glory",
    "Type": "Terrain",
    "Width": 9.01,
    "Length": 9.01,
    "Height": 10.01,
    "Shape": 0
  },
  {
    "Id": "2765",
    "Name": "Tower",
    "Type": "Terrain",
    "Width": 15.24,
    "Length": 15.24,
    "Height": 10.01,
    "Shape": 0
  },
  {
    "Id": "2766",
    "Name": "Wall",
    "Type": "Terrain",
    "Width": 24.01,
    "Length": 8.01,
    "Height": 10.01,
    "Shape": 0
  },
  {
    "Id": "2767",
    "Name": "Broken Wall",
    "Type": "Terrain",
    "Width": 30.01,
    "Length": 8.01,
    "Height": 10.01,
    "Shape": 0
  },
  {
    "Id": "2768",
    "Name": "Door",
    "Type": "Terrain",
    "Width": 24.01,
    "Length": 8.01,
    "Height": 10.01,
    "Shape": 0
  },
  {
    "Id": "3805",
    "Name": "Wood",
    "Type": "Terrain",
    "Width": 25.4,
    "Length": 15.24,
    "Height": 0.5,
    "Shape": 0
  },
  {
    "Id": "3806",
    "Name": "Hill",
    "Type": "Terrain",
    "Width": 20.32,
    "Length": 15.24,
    "Height": 2.6,
    "Shape": 0
  },
  {
    "Id": "3807",
    "Name": "House",
    "Type": "Terrain",
    "Width": 20.32,
    "Length": 15.24,
    "Height": 12.01,
    "Shape": 0
  },
  {
    "Id": "3808",
    "Name": "Impassable",
    "Type": "Terrain",
    "Width": 15.24,
    "Length": 15.24,
    "Height": 10.01,
    "Shape": 0
  },
  {
    "Id": "3809",
    "Name": "Dark Ruin",
    "Type": "Terrain",
    "Width": 20.32,
    "Length": 20.32,
    "Height": 4.5,
    "Shape": 0
  },
  {
    "Id": "3810",
    "Name": "Obstacle",
    "Type": "Terrain",
    "Width": 20.32,
    "Length": 2.59,
    "Height": 1.3,
    "Shape": 0
  },
  {
    "Id": "3811",
    "Name": "Water",
    "Type": "Terrain",
    "Width": 25.4,
    "Length": 15.24,
    "Height": 0.5,
    "Shape": 0
  },
  {
    "Id": "3812",
    "Name": "Field",
    "Type": "Terrain",
    "Width": 20.32,
    "Length": 15.24,
    "Height": 1.6,
    "Shape": 0
  },
  {
    "Id": "4592",
    "Name": "Baggage Trains",
    "Type": "Terrain",
    "Width": 6.01,
    "Length": 10.01,
    "Height": 1.01,
    "Shape": 0
  }
]
